{
  "schema_version": "1.0.0",
  "product_id": "chatvaultai",
  "display_name": "ChatVaultAI",
  "created_at": "2026-07-10T00:00:00.000Z",
  "description": "Desktop application for AI conversation capture, evidence preservation, and receipt management.",
  "repository": {
    "provider": "github",
    "owner": "daytona3dan-coder",
    "repository": "chatvault-ai-desktop"
  }
}
